{
  "id": "man_0191e8a0-0000-4000-8000-000000000010",
  "version": "0.1",
  "character_id": "char_0191e8a0-0000-4000-8000-000000000001",
  "master_asset_id": "asset_master_neutral",
  "canvas": {
    "width": 256,
    "height": 256
  },
  "spatial_references": [
    {
      "id": "view_full",
      "view_rect_canvas": [
        0,
        0,
        1,
        1
      ],
      "source_pixel_rect": [
        0,
        0,
        256,
        256
      ],
      "output_size": [
        256,
        256
      ]
    }
  ],
  "layers": [
    {
      "id": "layer_0191e8a0-0000-4000-8000-backhair01",
      "display_name": "back_hair",
      "semantic": "BACK_HAIR",
      "side": "CENTER",
      "index": 1,
      "z_index": 10,
      "group": "BACK_HAIR",
      "canvas_bounds": {
        "x": 0.25,
        "y": 0.08,
        "w": 0.5,
        "h": 0.55
      },
      "source": {
        "type": "master_pixels",
        "asset_path": "layers/back_hair.png"
      },
      "status": "READY"
    },
    {
      "id": "layer_0191e8a0-0000-4000-8000-body00001",
      "display_name": "body",
      "semantic": "BODY",
      "side": "CENTER",
      "index": 1,
      "z_index": 20,
      "group": "BODY",
      "canvas_bounds": {
        "x": 0.3,
        "y": 0.45,
        "w": 0.4,
        "h": 0.5
      },
      "source": {
        "type": "master_pixels",
        "asset_path": "layers/body.png"
      },
      "status": "READY"
    },
    {
      "id": "layer_0191e8a0-0000-4000-8000-arml00001",
      "display_name": "arm_left",
      "semantic": "ARM",
      "side": "LEFT",
      "index": 1,
      "z_index": 25,
      "group": "ARMS",
      "canvas_bounds": {
        "x": 0.18,
        "y": 0.48,
        "w": 0.18,
        "h": 0.35
      },
      "source": {
        "type": "master_pixels",
        "asset_path": "layers/arm_l.png"
      },
      "status": "READY",
      "overlap": {
        "required_with": [
          "layer_0191e8a0-0000-4000-8000-body00001"
        ],
        "minimum_px_at_master_resolution": 8
      }
    },
    {
      "id": "layer_0191e8a0-0000-4000-8000-armr00001",
      "display_name": "arm_right",
      "semantic": "ARM",
      "side": "RIGHT",
      "index": 1,
      "z_index": 25,
      "group": "ARMS",
      "canvas_bounds": {
        "x": 0.64,
        "y": 0.48,
        "w": 0.18,
        "h": 0.35
      },
      "source": {
        "type": "master_pixels",
        "asset_path": "layers/arm_r.png"
      },
      "status": "READY"
    },
    {
      "id": "layer_0191e8a0-0000-4000-8000-face00001",
      "display_name": "face",
      "semantic": "FACE",
      "side": "CENTER",
      "index": 1,
      "z_index": 40,
      "group": "FACE",
      "canvas_bounds": {
        "x": 0.32,
        "y": 0.12,
        "w": 0.36,
        "h": 0.36
      },
      "source": {
        "type": "master_pixels",
        "asset_path": "layers/face.png"
      },
      "status": "READY"
    },
    {
      "id": "layer_0191e8a0-0000-4000-8000-eyel00001",
      "display_name": "eye_left",
      "semantic": "EYE",
      "side": "LEFT",
      "index": 1,
      "z_index": 50,
      "group": "EYES",
      "canvas_bounds": {
        "x": 0.38,
        "y": 0.22,
        "w": 0.1,
        "h": 0.08
      },
      "source": {
        "type": "master_pixels",
        "asset_path": "layers/eye_l.png"
      },
      "status": "READY"
    },
    {
      "id": "layer_0191e8a0-0000-4000-8000-eyer00001",
      "display_name": "eye_right",
      "semantic": "EYE",
      "side": "RIGHT",
      "index": 1,
      "z_index": 50,
      "group": "EYES",
      "canvas_bounds": {
        "x": 0.52,
        "y": 0.22,
        "w": 0.1,
        "h": 0.08
      },
      "source": {
        "type": "master_pixels",
        "asset_path": "layers/eye_r.png"
      },
      "status": "READY"
    },
    {
      "id": "layer_0191e8a0-0000-4000-8000-mouth001",
      "display_name": "mouth",
      "semantic": "MOUTH",
      "side": "CENTER",
      "index": 1,
      "z_index": 55,
      "group": "FACE_DETAIL",
      "canvas_bounds": {
        "x": 0.44,
        "y": 0.36,
        "w": 0.12,
        "h": 0.06
      },
      "source": {
        "type": "master_pixels",
        "asset_path": "layers/mouth.png"
      },
      "status": "READY"
    },
    {
      "id": "layer_0191e8a0-0000-4000-8000-frhair01",
      "display_name": "front_hair",
      "semantic": "FRONT_HAIR",
      "side": "CENTER",
      "index": 1,
      "z_index": 70,
      "group": "FRONT_HAIR",
      "canvas_bounds": {
        "x": 0.28,
        "y": 0.05,
        "w": 0.44,
        "h": 0.28
      },
      "source": {
        "type": "master_pixels",
        "asset_path": "layers/front_hair.png"
      },
      "status": "READY",
      "overlap": {
        "required_with": [
          "layer_0191e8a0-0000-4000-8000-face00001"
        ],
        "minimum_px_at_master_resolution": 12
      }
    }
  ],
  "occlusion_edges": [
    {
      "id": "occ_bang_face",
      "occluder": "layer_0191e8a0-0000-4000-8000-frhair01",
      "occludee": "layer_0191e8a0-0000-4000-8000-face00001",
      "notes": "Bangs over forehead (M2 target)"
    },
    {
      "id": "occ_face_backhair",
      "occluder": "layer_0191e8a0-0000-4000-8000-face00001",
      "occludee": "layer_0191e8a0-0000-4000-8000-backhair01",
      "notes": "Face over back hair"
    },
    {
      "id": "occ_body_arm",
      "occluder": "layer_0191e8a0-0000-4000-8000-body00001",
      "occludee": "layer_0191e8a0-0000-4000-8000-arml00001",
      "notes": "Body over arm root"
    }
  ]
}